{
  "tenant_id": "11111111-1111-4111-8111-111111111111",
  "runtime_tenant_id": "66666666-6666-4666-8666-666666666666",
  "operation_id": "22222222-2222-4222-8222-222222222222",
  "state": "blocked",
  "version": 2,
  "resources_state": "unknown",
  "error_code": null,
  "creation_succeeded": true
}
